我被他气到快要吐血。	我/予/伊/气/甲/强欲/呸血/。
一群老年人在公园里聊天、下棋排遣时间。	一/阵/老大人/伫/公园仔/内面/开讲/、/行棋/做议量/。
他衣服穿得很紧。	伊/衫/穿/了/有/够/束/。
没证据不可以乱讲。	无/证据/毋通/乌白/讲/。
一起上街买东西去！	来去/街仔/买/物件/！
他每学期都当班长，成绩也很好。	伊/每/学期/拢/做/班长/，/成绩/嘛/真/好/。
不知道他什么时候才会来。	毋/知影/伊/当时/才/会/来/。
你还有什么事情？	你/犹有/啥物/代志/？
钱不要随便花用。	钱/莫/乌白/开/。
他一听到得了大奖，却站在那里发怔。	伊/一/听/着/着/大奖/，/煞/徛/踮/遐/起戆/。
这个地方很宽阔。	这/个/所在/诚/开阔/。
这个孩子只顾白食不肯赚钱，实在枉然。	这个/囡仔/欲/食/毋/讨趁/，/有/够/了然/。
要进去人家的办公室之前要先敲门。	欲/入去/人/的/办公室/进前/爱/先/挵/门/。
知道的人举手！	知影/的/人/攑手/！
人生如戏，戏如人生。	戏台/小/人生/，/人生/大/戏台/。
你最爱哭了。	你/并/爱/哭的/。
事情都由他指挥！	代志/拢/伊/咧/拍派/！
他坐累了，在那里伸懒腰。	伊/坐/了/𤺪矣/，/伫/遐/伸匀/。
被孩子绊住无法出门。	予/囡仔/缚牢咧/袂当/出门/。
你真不知死活，那么高也敢跳下去。	你/有够/儑面/，/遐尔/悬/曷/敢/跳落去/。
你要小心点，才不会被他暗中动手脚。	你/爱/较/细腻咧/，/才/袂/予/伊/创空/。
把房间打扫一下。	共/房间/摒摒咧/。
你真笨，连好人坏人都分不出来。	你/有够/戆/，/连/好歹/人/都/分/袂/出来/。
这个摆渡老伯很擅长跟客人对唱褒歌。	这/个/撑渡/伯仔/真/𠢕/和/人客/唱/褒歌/。
你要成器一些。	你/就/较/成人咧/。
他对人很有爱心。	伊/对/人/真/有/疼心/。
虽然是小人物，也不可以藐视。	虽然/是/小/人物/，/嘛/袂使/藐视/。
这件事情要是传出去，会很不光彩。	这/件/代志/若是/传出去/，/会/真/歹听/。
那个乞丐每天都去车站向人乞讨。	彼/个/乞食/逐工/拢/去/车头/共/人/分/。
我们这里只有做批发生意，没有做零售。	阮/遮/干焦/做/大卖/，/无/咧/卖/零星的/。
水沟塞住了，难怪会积水。	沟仔/窒牢咧/，/较加/嘛/会/驻水/。
是谁跟你说我要嫁给他？	是/啥人/共/你/讲/我/欲/嫁伊/？
无论事情最后如何，我都会支持你。	无论/代志/上尾/按怎/，/我/拢/会/支持你/。
咱们是知己，不要相瞒。	咱/是/知己/，/毋通/相瞒/。
昨夜我很难入眠。	昨暝/我/真/歹困/。
有就买，没有就算了。	有/就/买/，/无/就/汰/。
出五百要跟他买。	出/五百/欲/共/伊/买/。
你说的我都了解了。	你/讲的/我/拢/明白矣/。
你还在那里张牙舞爪，早晚会被人打。	你/阁/伫/遐/𫜮牙/，/早慢/会/去/予/人/推/。
豆腐腌盐来煎很好吃。	豆腐/豉/盐/来/煎/真/好/食/。
他被人比喻成菩萨。	伊/予/人/比喻/做/菩萨/。
今年的大考竞争得很剧烈。	今年/的/大考/竞争/甲/真/剧烈/。
是他带头抗议的。	是/伊/做头/抗议的/。
床被小孩踏坏了。	眠床/予/囡仔/𧿬/甲/歹去/。
低着头坐在那里看报纸。	头/犁犁/坐/伫/遐/看/报纸/。
我今天很忙，公司的事情就麻烦你代理一下。	我/今仔日/无闲/，/公司/的/代志/才/劳烦/你/代理一下/。
他昨晚酒醉沤吐，到现在还在不舒服。	伊/昨暗/出酒/，/到今/犹/咧/艰苦/。
这下子惨了。	今/这声/害矣/。
你念一遍给我听。	你/读/一/遍/予/我/听/。
学生们去向老师告状。	学生/去/共/老师/投/。
这个案件是人伦悲剧。	这个/案件/是/人伦/悲剧/。
我老早就知道他有问题。	我/老早/就/知影/伊/有/问题/。
他下巴长得像戽斗。	伊/生/做/戽斗/戽斗/。
法医就是在替人家解剖验尸的。	法医/就/是/咧/替/人/破腹/验尸的/。
小孩子都很爱吹气球。	囡仔/拢/真/爱/歕/鸡胿仔/。
为了求得温饱，再怎么辛苦都不怕。	为着/欲/顾三顿/，/阁较/艰苦/嘛/毋/惊/。
走正步，脚步要一致。	𫏐跤步/，/跤步/着/和齐/。
今晚我有一个饭局，不回去吃晚餐了。	下昏/我/有/一/个/食饭会/，/无/欲/转去/食暗矣/。
他一开口就很凶恶，好像我们都欠他钱似的。	伊/开喙/就/恶确确/，/袂输/咱/拢/欠/伊/的/钱咧/。
我们两个错身而过，却都没有看到对方。	阮/两/个/相闪身/，/煞/拢/无/看/着/对方/。
你内衣袖子露出来了，赶快将它拉进去。	你/内衫/的/手䘼/捅出来矣/，/紧/搝入去/。
我没时间去买礼物，干脆折算现金给你。	我/无/时间/去/买/礼物/，/规气/打/现金/予你/。
你处事不公，迟早会出事。	你/看/人/大细目/，/早慢/会/出代志/。
车子放外面，下雨之后却卡积了一层水垢。	车/囥/伫/外口/，/落雨/了后/煞/卡/一/沿/水鉎/。
他把他的私人花园公开展览。	伊/公开/展览/伊/的/私人/花园/。
花盆被小狗踩坏了。	花坩/予/狗仔/𧿬歹矣/。
一个好好的女孩却被你蹧蹋。	一/个/好好/的/查某/囡仔/煞/去/予/你/蹧跶/。
那块饼干发霉了，不要吃！	彼/块/饼/生菇矣/，/毋通/食/！
这次尾牙餐会让你去安排。	这/摆/尾牙/的/餐会/予/你/去/安排/。
跟你这种不可理喻的人说话真累。	佮/你/这/个/番仔/讲话/真/忝/。
饭太多，要拨些出来我才吃得下。	饭/伤/济/，/爱/减/一寡起来/我/才/食/会/去/。
这样是对准的吗？	按呢/敢/有/对/？
量看看有没有发烧？	度/看/有/发烧无/？
听说他的后盾台很强势，最好别去招惹得罪他。	听讲/伊/的/后壁山/诚/崎/，/上好/莫/去/得失伊/。
他咳痰咳了一整夜。	伊/喀/痰/喀/规/暝/。
他很有勇气，什么都不怕。	伊/真/有/胆量/，/啥物/拢/毋/惊/。
那条路中央有一个坑，你要小心点。	彼/条/路/中央/有/一/凹/，/你/着爱/较/细腻咧/。
他不敢直接看，只用眼角余光偷瞄。	伊/毋/敢/直接/看/，/干焦/用/目尾/偷/䀐/。
旗子的须要掉光了。	旗仔须/落/欲/了矣/。
每件事都要计较，最后吃亏的会是你自己。	逐项/拢/欲/计较/，/上尾/食亏的/是/你/家己/。
枉费你那么爱他，结果他还是脚踏两条船。	无彩/你/遐尔仔/爱伊/，/结果/伊/犹是/双/跤/踏/双/船/。
这里四周围都是山，环境很好。	遮/四面/拢/是/山/，/环境/真/好/。
医生说他不要紧，你不用烦恼啦！	医生/讲/伊/无要紧/，/你/毋免/烦恼啦/！
用细竹子教训小孩不一定有用。	教/囡仔/用/秀梳仔/无/一定/有效/。
树杈拿来当柴烧。	树桠/取来/做/柴/燃/。
这些饼干已经发霉长菌了，不要吃。	遮/的/饼/臭殕去矣/，/毋通/食/。
你若不相信，我们就来打赌。	你/若/毋/相信/，/咱/就/来/相输/。
他生来身材就比较瘦小。	伊/生做/较/幼骨/。
你这样讲，好像说是我做错了。	你/按呢/讲/，/袂输讲/是/我/做/毋着/。
太多了，我做不完。	伤/济/，/我/做/袂/去/。
他在缝补那件裙子。	伊/伫/咧/补紩/彼/领/裙/。
你整天这样唠叼不休，难道不会口渴吗？	你/规/工/按呢/踅踅念/，/敢/袂/喙焦/？
木材做的东西要磨平才好看。	柴/做的/物件/爱/鑢/予/伊/平/才/好/看/。
他早先是在种田，现在是在做生意。	伊/较早/咧/作田/，/这马/咧/做生理/。
这种肥皂不耐洗。	这种/雪文/真/无/洗/。
有船沉到海里去了。	有/船仔/沉/落去/海里矣/。
你要认真努力，才会有出人头地的一天。	你/着爱/认真/拍拚/，/才/有/出头/的/一日/。
我看到有人在水中挣扎浮沉。	我/看着/有人/伫/水底/沐沐泅/。
我们去逛那里的夜市，好不好？	咱/来去/踅/彼搭/的/夜市仔/，/好无/？
他买彩券中奖，同事们都叫他要请客。	伊/买/彩券/着奖/，/同事/拢/叫/伊/爱/请/。
那个人很奸诈，不要被他骗了。	彼/个/人/真/狡怪/，/毋通/予/伊/骗去/。
妈妈去布庄买布要做新衣服。	妈妈/去/布庄/剪布/欲/做/新/衫/。
这条提案大家已经讨论完毕，接下来咱们就来表决。	这/条/提案/逐家/已经/讨论/好势/，/绁落来/咱/就/来/表决/。
对着大腿用力捏下去。	出力/对/大腿/共/伊/捻落去/。
你女儿什么时候要嫁过去？	恁/查某囝/啥物/时阵/欲/过门/？
他很会钻营。	伊/真/𠢕吮食/。
他以前是很有名的明星。	伊/较早/是/真/出名/的/明星/。
他好比是只被人关在笼子里面的小鸟。	伊/可比/一/只/予/人/关/伫/笼仔内/的/鸟仔/。
他已经隔了一个月没回家了。	伊/已经/阆月/无/转来矣/。
跌落万丈深渊	跋落/万丈深坑
得到结核病的人会吐血。	致/着/肺痨/的/人/会/呕血/。
价钱很合理。	价钱/真/公道/。
天冷了，你要加件衣服。	天气/冷矣/，/你/着/爱/加/笼/一/领/衫/。
你要的东西在更里面。	你/爱/的/物件/伫/较/内面/。
要下山得趁早，如果开始起雾，看不到路就危险。	欲/落山/着/冗早/，/若/开始/罩雺/，/看/袂/着/路/就/危险/。
一下子就好了。	一下仔久/就/好矣/。
整个抽屉翻透了。	规/个/屉仔/侥透透/。
她的腰很漂亮。	伊/的/腰/真/媠/。
我每样都帮你准备好了，你不用烦恼。	我/逐/项/都/共/你/攒/便便矣/，/你/免/烦恼/。
他长得那么地美，追他的人极多。	伊/生做/遐尔仔/媠/，/逐/伊/的/人/是/窒倒街/。
我的眼尾开始有皱纹了。	我/的/目尾/开始/有/皱痕矣/。
她的声音就好像破鸡帚一样刺耳，我听得快昏倒。	伊/的/声/若亲像/破鸡筅/，/我/听/着/强欲/昏倒/。
五官长相不错。	尪仔头/袂/䆀/。
右耳进、左耳出。比喻善忘。	一/耳空/入/，/一/耳空/出/。
东西收一收！	物件/抾抾咧/！
去山上取药材。	去/山顶/取/药材/。
他找不到你就捉我充数。	伊/揣/你/袂/着/就/掠/我/去/抵额/。
钉错地方的铁钉要用拔钉器拔起来。	钉/毋着/所在/的/铁钉仔/着/用/铁钉挽/挽起来/。
他爸爸若跟他翻脸，他就快要哭了。	𪜶/老爸/若/对/伊/变面/，/伊/就/覕须/。
我赶着到车站买车票。	我/欲/赶/来去/车头/拆票/。
他违反规定，被主办单位取消资格了。	伊/违反/规定/，/去/予/主办/单位/除名矣/。
下雨了，拿把伞来遮一下。	落雨矣/，/攑/雨伞/来/遮闸一下/。
这次考试成绩的分布很平均。	这/摆/考试/成绩/的/分布/真/平均/。
我之后就到。	我/随后/就/到/。
我的红茶不要加糖。	我/的/红茶/无/爱/掺/糖/。
那个年轻人看起来很潇洒。	彼/个/少年的/看/着/诚/飘撇/。
这些你全买，我算你便宜一点。	遮的/你/总贸/，/我/算/你/较/俗/。
整路都是车，不知要堵到何时。	规路/拢/是/车/，/毋知/欲/窒/甲/当时/。
他从小就做童工。	伊/从/细汉/就/咧/做/囡仔工/。
这件事情你不要推拖给我。	这/件/代志/你/莫/捒/予我/。
那个女孩子很漂亮。	彼/个/查某/囡仔/真/媠/。
工作没做完，休想要吃晚餐。	工课/若/无/做煞/，/免/数想/欲/食/暗顿/。
他怎么蹲坐下去了?赶快把他扶起来。	伊/哪/会/蝹落去/？/紧/共/伊/插起来/。
我不会放过他。	我/无/欲/放/伊/干休/。
你身上带这么多钱，不可露出来被人看到。	你/身躯/扎/遐/济/钱/，/毋通/现/出来/予/人/看着/。
这大家都知道，你何必再说？	这/逐家/拢/知矣/，/你/曷着/阁/讲/？
你妈妈正想到你而提起你。	恁/老母/拄/咧/念你/。
他们父子在车站分手。	𪜶/爸仔囝/伫/车头/分开/。
她是一个风尘女郎。	伊/是/一/个/𨑨迌查某/。
这样比较麻烦，你再想一想是否有其他办法？	按呢/较/费气/，/你/阁/想/看/有/别/种/方法无/？
听到车祸的消息，他整个人都傻了。	听着/车祸/的/消息/，/伊/规个/人/拢/愣去/。
他说他下个星期要出国考察。	伊/讲/伊/后礼拜/欲/出国/考察/。
你的额头长了疮粒，要赶快擦药。	你/额头/生/粒仔/，/爱/紧/抹/药仔/。
你们一群人站在那里，是想要做什么？	恁/规阵/人/徛/伫/遐/，/是/欲/创/啥/？
大家合伙做生意，赚的钱他不能独吞。	逐家/合股/做/生理/，/趁/的/钱/伊/袂使/规碗捀/。
要买柚子要挑感觉沉重的。	欲/买/柚仔/爱/拣/较/有/重的/。
连商量一下都不行，还要东扯西扯，你实在很难相处。	连/参详一下/都/无/通/，/阁/欲/讲东讲西/，/你/实在/真/聬儱/。
诈骗集团一人当诱饵，装成有钱的傻子，另一人就鼓动受害者去跟他换钱。	金光党/一/个/做囮/，/假做/有钱的/戆囝/，/一/个/就/鼓舞/受害者/去/佮/伊/换钱/。
你突然叫了一声，孩子被吓到了！	你/雄雄/喝/一/声/，/囡仔/煞/着惊/！
他是我们同宗的。	伊/是/阮/祧仔内的/。
神明祭祀庆典时的说词。	恭/请/众/神/銮驾/。
他有打电话过来请假。	伊/有/敲/电话/来/请假/。
他说谎，被他爸爸打手心。	伊/讲白贼/，/予/𪜶/老爸/拍/手蹄仔/。
你在那里做什么？	你/伫/遐/咧/创/啥货/？
今天有客人要来，你要准备六个碗才够。	今仔日/有/人客/欲/来/，/你/爱/准备/六/块/饭碗/才/有够/。
再怎么痛苦也不应寻短见。	阁较/艰苦/嘛/毋通/行短路/。
你莫不是老糊涂了！	你/毋/咧/老颠倒/！
他到庙里上香。	伊/去/庙里/拈/香/。
在巷子口有没有，那间杂货店。	伫/巷仔口/无/，/彼/间/𥴊仔店/。
撕一块鸡肉来吃。	裂/一块仔/鸡肉/来/食/。
这颗花生很饱满。	这/粒/涂豆/真/仁/。
半只鸡吃光光。	鸡/规爿/食了了/。
她在里面穿裙子，等一下就出来了。	伊/伫/内底/縖/裙/，/小等/就/出来矣/。
整车的货都卖给你。	规/车/的/货/拢/贩你/。
笔写到分叉了。	笔/写/甲/必叉矣/。
我们打算下星期要去他们家提亲。	阮/拍算/后/礼拜/欲/去/𪜶/兜/提亲/。
我的希望全寄于你身上。	我/的/希望/拢/寄托/伫/你/的/身上/。
慢慢喝，才不会呛到。	慢慢仔/啉/，/才/袂/去/嗾着/。
你不要揭人家的疮疤。	你/莫/黜/人/的/根仔络仔/。
心事没有人知道，我压抑得很难过。	心事/无/人/知/，/我/郁/甲/足/艰苦的/。
那个人看起来很有权威。	彼/个/人/看起来/诚/有/权威/。
手骨断掉了。	手骨/折去矣/。
现在的人都很少写信了。	这马/的/人/拢/罕得/写/批矣/。
俗语，有钱能使鬼推磨。	有钱/使/鬼/会/挨磨/。
做人必须守本份。	做人/着/守/本份/。
我听说别的地方价钱比这里便宜。	我/听讲/别搭/的/价数/比/遮/较/俗/。
我爷爷七十岁生日的时候，我们家有开席宴客。	阮/阿公/七十/岁/大寿/的/时阵/，/阮/兜/有/办桌/请人/。
杀人不用刀。	杀/人/免/用/刀/。
他眼睛翻白眼，就像要昏过去了。	伊/目睭/反白睚/，/若/像/欲/昏去矣/。
你不要让那个花心萝卜骗了。	你/毋通/予/彼个/姼仔诙/骗去/。
他具有将相才能，为国家规划很多事情。	伊/诚/将才/，/为/国家/计划/足/济/代志/。
把鸡拿去剁一剁可以吃。	鸡/去/剁剁咧/通好/食/。
长辈整天坐在屋内，不愿出去跟人攀谈，就会慢慢失智。	老大人/规日/坐/伫/厝内/，/毋/出去/佮/人/开讲/，/会/一直/侗戆去/。
作业随便写两下就交了出去。	作业/凊彩/聿聿咧/就/交/出去/。
这个名字真陌生，我没听过。	这/个/名/真/生份/，/我/毋捌/听/过/。
他用草做一只狗。	伊/用/草/做/一/只/狗/。
伤口裂缝很大。	空喙/真/大/裂/。
这颗芒果已经过熟了。	这/粒/檨仔/伤/过分矣/。
大家要互相体谅，不要计较。	逐家/着爱/互相/体谅/，/毋通/计较/。
我们做事情，立场要坚定，才不会让人家批评。	咱/做/代志/，/立场/着/爱/坚定/，/才/袂/去/予/人/批评/。
台湾是很大的岛屿。	台湾/是/一/个/真/大/的/岛/。
牛车驶进烂泥地，无法动弹。	牛车/驶/入/湳涂/，/驶/袂/行/。
他常常嫌东嫌西，所以很多人骂他毛病多。	伊/定定/嫌东嫌西/，/予/真/济/人/骂/伊/厚屎/。
一只鸟站在稻草人的头顶上。	一/只/鸟仔/徛/伫/稻草人/的/头壳顶/。
上级管下级，一级管一级。	顶司/管/下司/，/锄头/管/畚箕/。
贱卖少赚些还是比赔钱好。	俗卖/减趁/较/赢/了钱/。
不过尔尔罢了。	不过/是/如此如此/尔尔/。
因为他发疯，所以都没去上班。	伊/因为/起痟/，/拢/无/咧/上班/。
我们的工头看起来还很年轻。	阮/的/工头/看起来/犹阁/真/少年/。
我现在在炖肉，你帮我注意着点。	我/这阵/咧/炕肉/，/你/共/我/斗/影一下/。
我想和你拍照。	我/想欲/佮/你/翕相/。
他在五招之内打败对手。	伊/伫/五/招/以/内/拍/败/对手/。
姑念他较不懂事，你稍微让他一下。	徛算讲/伊/较/毋捌/代志/，/你/小/让伊一下/。
这封信麻烦你帮我代写一下。	这/张/批/麻烦/你/替/我/代笔一下/。
他说的都是子虚乌有的。	伊/讲/的/话/拢/无影无迹/。
车子快开了，你如果不快点就来不及了。	车/咧欲/开矣/，/你/若/无/较/紧咧/就/袂赴矣/。
叫他不要去，他硬要去。	叫/伊/莫/去/，/伊/强/欲/去/。
上个月月经没有来。	顶个月/月经/无/来/洗/。
他的脸形比较圆。	伊/的/面形/较/圆/。
这个地方真避风。	这/个/所在/真/闪风/。
水电工程包给姓张的做。	水电/的/工程/贸/予/张的/做/。
初一十五要烧香拜拜。	初一/十五/爱/烧香/拜拜/。
你陪我去学校好不好？	你/陪/我/去/学校/好无/？
他不说，别人怎么会知道他心里在想什么。	伊/毋/讲/，/人/哪/会/知影/伊/心内/咧/想/啥/。
这是非常有意义的创举。	这/是/诚/有/意义/的/创举/。
叫到这种不成材的人做不了事。	叫/甲/这号/半丁/袂/做/工课/。
竹筒饭最早是原住民的一种食物。	竹管仔饭/上/早/是/原住民/的/一/种/食物/。
这只皮箱里面装什么东西？	这/跤/皮箱/内底/贮/啥物/？
说话要看场合。	讲话/爱/看/场合/。
这本杂志是月刊。	这/本/杂志/一/个/月/出/一/期/。
今天忙到连短暂休息的机会也没有。	今仔日/无闲/甲/连/喘气/的/机会/都/无/。
一人五百元，刚好两千。	一/人/五/百/，/斗/做/两/千/。
虽然家里很穷，他都不曾怨恨悲叹。	虽然/厝内/真/散/，/伊/拢/毋/捌/怨叹/。
他是个泥水匠。	伊/是/做涂水的/。
你爷爷老糊涂了，说话颠三倒四。	恁/阿公/老番颠矣/，/讲话/去去倒倒/。
听说深山里有很多幽灵鬼怪。	听讲/深山林内/有/足/济/魔神仔/。
虽然他长这么大了，有时候还是很孩子气。	虽然/伊/遮尔/大汉矣/，/有时阵/犹是/足/囡仔款呢/。
汤煮得这么咸，要怎么喝？	汤/煮/甲/咸笃笃/，/是/欲/按怎/食/？
早就告诉你，没能耐就别做，你就是不自量力。	早/就/共/你/讲/，/无/彼号/尻川/就/毋通/食/彼号/泻药仔/。
他们两个长得一模一样。	𪜶/两/个/生做/一模一样/。
心声合唱团都是张先生在带领。	心声/合唱团/拢/是/张先生/咧/𤆬领/。
咱们中元普渡那天，供品得准备丰盛点，来祭拜好兄弟。	咱/七月半/普渡/彼/工/，/菜碗/着/攒/较/腥臊咧/，/来/拜/好兄弟仔/。
今天是好日子，很多人嫁娶。	今仔日/是/大日/，/真/济/人/嫁娶/。
他退休后整天闲着没事干，经常到处去游山玩水。	伊/退休/了后/规/日/闲仙仙/，/定定/四界/去/游/山/玩/水/。
台湾的莲雾已经行销到日本了。	台湾/的/莲雾/已经/拍/入去/日本/的/市场矣/。
他身体病痛缠身还得赚钱养全家，实在很可怜。	伊/拖身拖命/趁钱/来/饲/一家伙仔/，/实在/真/可怜/。
每个人的兴趣都不相同。	逐/个/人/的/兴趣/拢/无/𫝛款/。
爷爷常常在我们家后面的竹丛下乘凉。	阿公/定定/伫/阮/厝后/的/竹模跤/歇凉/。
车站附近有很多会拉客的计程车。	车头/附近/有/真济/叫/客/的/计程车/。
那个人很懒，好吃懒做。	彼/个/人/真/懒尸/，/欲/食/毋/振动/。
稻子长高吐穗了。	稻/仔/抽长/结穗矣/。
你快拦住他！	你/紧/共/伊/挡咧/！
一件衣服穿得歪七扭八，真难看。	一/领/衫/穿/甲/歪膏揤斜/，/有够/歹看/。
他四十岁了，身材还保持得很好。	伊/四十/岁矣/，/身材/阁/保持/甲/真/好/。
他动不动就怪罪别人。	伊/磕袂着/就/欲/怪人/。
世人都自私，只知道顾自己的利益。	世间人/拢/真/自私/，/干焦/知影/顾/家己/的/利益/。
我被他凌虐得很惨。	我/予/伊/凌勒/甲/真/忝/。
病一下竟然变成病夫了。	病/一下/煞/半丁去/。
放高利贷的人会不得好死。	放/重利/的/人/会/无/好/死/。
这个地方没什么好眷恋的了。	这/个/所在/无/啥物/通好/留恋矣/。
他到处乱说我的事，我要告他。	伊/四界/乌白/讲我/，/我/欲/告伊/。
他讲话都带着口头禅。	伊/讲话/拢/带/一/个/话母/。
他把西瓜切成四块。	伊/共/西瓜/切/做/四/块/。
这些东西都是免税的。	遮的/物件/拢/是/免税的/。
他的父母亲都不识字。	𪜶/爸母/拢/毋/捌字/。
这种小事我来应付就好了。	这/款/小可仔/代志/我/来/应付/就/好/。
他跌落山谷，脚摔断了。	伊/跋/落去/山沟/，/跤骨/摔/断去/。
我们傍晚来逛夜市。	咱/下昏/来去/踅/夜市/。
他大前天才从欧洲回来。	伊/落昨日/才/对/欧洲/转来/。
他的长处就是对人很有礼貌。	伊/的/优点/就/是/对/人/真/有/礼貌/。
他那只鼻子很漂亮。	伊/彼/支/鼻/真/媠/。
这个吊儿郎当的家伙，吃饭用海碗，做工作就开溜。	这/箍/浮浪贡/，/食饭/食/碗公/，/做/工课/闪/西风/。
外面很冷，你要出门应加一件棉袄。	外口/真/寒/，/你/欲/出门/爱/加/叠/一/领/棉裘/。
他不小心竟跌到山沟底。	伊/无/注意/煞/跋落/坑沟/底/。
事情越来越棘手。	代志/愈/来/愈/歹纺/。
他被老板炒鱿鱼了。	伊/去/予/头家/共/伊/辞/头路矣/。
他的企图真明显，大家稍微看一下就晓得。	伊/的/企图/真/明显/，/逐家/小/看/咧/就/知/。
我家今天要宴客。	阮/兜/今仔日/欲/请人客/。
这条丝线截短一点。	这/条/线/扯/较/短一点仔/。
他脾气若爆发，你就该死。	伊/性地/若/发/，/你/就/该死/。
这片草皮很平。	这/片/草埔/真/平/。
他的五官长得很好。	伊/鼻目喙/生做/诚/媠款/。
他连一点机会都不给我，我真不甘心。	伊/连/一点仔/机会/都/毋/予我/，/我/诚/毋愿/。
这台机器用久失准了。	这/台/机器/用/久/走精去矣/。
你这么点儿钱能做什么？	你/这点仔/钱/会当/创/啥/？
他是让你不是怕你，你不可以得寸进尺喔！	伊/是/让你/，/毋/是/惊你/，/你/毋通/软涂深掘喔/！
公园里黑漆漆，看来很恐怖。	公园内/暗趖趖/，/看着/足/恐怖/。
他从小就很会存钱。	伊/自/细汉/就/真/𠢕/俭钱/。
你这次的成绩有点退步。	你/这过/的/成绩/有/淡薄仔/退步/。
我去香港看人家赛马。	我/去/香港/看/人/跑马/。
这件事情我可以替你担保。	这/件/代志/我/会当/共/你/担保/。
那个人长得瘦黑难看。	彼/箍/生做/猴猴/。
他失手将别人打伤。	伊/错手/共/人/拍/着伤/。
我们做事情必须依循规则来走。	咱/做/代志/着爱/照/法度/来/行/。
这次请客是要办桌，还是到餐厅吃？	这/摆/请/人客/是/欲/办桌/，/抑是/欲/去/食餐厅/？
酒店今天来了一位多金客。	今仔日/酒楼/来/一/只/金丝猴/。
除了竹子和七里香以外，朱槿也是最常种植来当围篱的树木。	除了/竹仔/佮/七里香/以外/，/灯仔花/嘛/是/上捷/种来/做/篱笆/的/树仔/。
总统派任他当大使派往联合国。	总统/委任/伊/做/大使/派/往/联合/国/。
你别挡在门口。	你/莫/挡/伫/门跤口/。
你舀一碗汤给我。	你/𣁳/一/碗/汤/予我/。
地板擦一擦。	涂跤/揉揉咧/。
创业都比较辛苦，你得要忍耐。	创业/拢/较/辛苦/，/你/着爱/忍耐/。
他要租房子，叫我帮他找。	伊/欲/税厝/，/叫/我/共/伊/斗/揣/。
海鱼若是现捕的贵得多。	咸水鱼/若是/现流仔/加/足/贵的/。
你们家住在哪里？	恁/兜/是/蹛/伫/佗位/？
你这个糊涂虫，连自己东西放哪里都不知道。	你/这/箍/散仙/，/连/家己/的/物件/囥/伫/佗位/都/毋/知/。
工作我自己来做还比较干脆！	工课/我/家己/做做咧/较/条直/！
晚上你不要在外面四处乱跑。	暗时/你/莫/伫/外口/抛抛走/。
你要好好打拚，为将来建造基础。	你/爱/好好仔/拍拚/，/为/将来/创造/基础/。
举头三尺有神明。	攑头/三/尺/有/神明/。
衣服都洗好了。	衫/拢/洗/好矣/。
他现在财运正好。	伊/这马/当咧/发/。
这条水管破掉了。	这/条/水管/破去矣/。
