他有难以启齿的病。	伊/有/僫/对/人/讲起/的/暗毵病/。
日语我稍微听得懂。	日本/话/我/普普仔/听/有/。
这件衣服浆得很硬挺，很好看。	这/领/衫/浆/了/真/硬挣/，/真/好看/。
运动场跑步我都赢他，但考试却都是他赢我。	走/运动埕/我/拢/赢伊/，/考试/伊/拢/赢我/。
他好色成性，一看到漂亮的女孩子就垂澜三尺。	伊/彼号/猪哥/性/，/看着/媠/查某/囡仔/就/流猪哥澜/。
这个小孩很顽皮。	这/个/囡仔/真/孽潲/。
那个女人很会用眼神引诱别人。	彼/个/查某/真/𠢕/用/目睭/共/人/勾/。
抽浓烟很伤肺部。	食/厚薰/真/伤/肺管/。
我跟你没得比。	我/佮/你/无/并/。
你注意一下，应该听得到。	你/斟酌一下/，/应该/听/会/着/。
市场距离这里很远，要走很久。	市场/离/遮/真/远/，/爱/行/真/久/。
他最近遭遇到了麻烦的事。	伊/近来/定定/去/拄着/麻烦/。
都是他在那边任意处理。	拢/是/伊/伫/遐/咧/挲圆/捏扁/。
你这些钱，还不够我塞手指缝。	你/遮的/钱/，/阁/无够/我/楔手缝/。
交通的路线要先安排好。	交通/的/线路/爱/先/安排/予/好/。
生意不好，干脆改行算了！	生理/无/好/，/规气/改途/好啦/！
出家人不可以吃荤食。	出家人/袂使/食臊/。
刚刚出大太阳，一下子就下大雨。	拄/才/出/大日/，/目𥍉仔/就/落/大/雨/。
好朋友就要真诚相对。	好/朋友/着爱/破腹/相见/。
是，我马上去做。	是/，/我/连鞭/去/做/。
年老以后眼茫目花，看报纸很费力。	食老/了后/目睭/花花/，/看/报纸/足/食力/。
他开车开得很顺。	伊/开车/开/甲/足/顺的/。
一张纸飞过来，他顺手接住它。	一/张/纸/飞过来/，/伊/出手/顺势/共/伊/接咧/。
有包内馅的是包子。	有/包馅/的/是/包子/。
旗子让风吹得漂动起来。	旗仔/予/风/吹/甲/撇咧撇咧/。
嫁娶的时候会有一位好命的妇人搀扶新娘子。	嫁娶/的/时阵/会/有/一/位/好命/的/妇人人/打扎/新娘/。
鸡只会来蹧踏菜园。	鸡仔/会/来/损/菜园/。
老年人需要人家搀扶。	老人/爱/人/扶持/。
他懂得很多种做瓷器的专门技术。	伊/捌/足/济/种/做/瓷仔/的/手路/。
他疼爱孩子，疼得要命。	伊/惜/囝/，/惜/甲/疼命命/。
你去买一些水果回来供奉神明。	你/去/买/一寡/果子/转来/供神/。
先规划好，再来执行。	先/规划/予/好/，/才/来/执行/。
他打算明年要买新房子。	伊/按算/明年/欲/买/新/厝/。
陈三五娘私奔的故事，在台湾很受欢迎。	陈三/五娘/相𤆬走/的/故事/，/伫/台湾/真/受/欢迎/。
他很嚣张，早晚会被人教训。	伊/诚/𪁎趒/，/早慢/会/予/人/教示/。
我这样掏心掏肺，难道你还不相信？	我/挖心肝/予/你/看/，/敢讲/你/阁/毋/相信/？
她很会理家。	伊/真/𠢕/拑家/。
你突然跑来借钱，我哪里生这么多钱借你。	你/青磅白磅/走来/欲/借钱/，/我/欲/佗/生/遐/济/钱/通/借你/。
一餐没吃，不会饿死。	一/顿/无/食/，/饿/袂/死/。
听说他和阿英在交往，是真的吗？	听讲/伊/佮/阿英/咧/交往/，/敢/有影/？
他那张嘴和机关枪一样，说个不停。	伊/彼/支/喙/佮/机关铳/仝款/，/讲/袂/煞/。
台湾童谣可以算是念谣。	台湾/囡仔歌/算/是/念谣/。
你千万不要再做坏事。	你/千万/毋通/阁/行/歹路/。
他说话的口气真大！	伊/讲话/的/气口/真/大/！
他是老先知，什么事都瞒不过他。	伊/是/老/先觉/，/啥物/代志/拢/瞒/伊/袂/过/。
你稍微托着一下，我来将它稳稳固定。	你/小/扶挺一下/，/我/来/共/固定/予/在/。
毕业之后找不到工作，只好暂时去当临时工。	出业/揣无/头路/，/只好/暂时/去/做/临时工/。
他总揽大权，我惹不起他。	伊/拢/大/权/，/我/惹/伊/袂/起/。
衣服沾到酱油。	衫/去/滒着/豆油/。
我们房东人很好，常常帮忙我们。	阮/厝头家/人/诚/好/，/定定/共/阮/斗相共/。
他还太稚嫩，所以不能做主管。	伊/犹阁/伤/茈/，/所以/袂当/做/主管/。
他刚才一直在大口喘气，好像很难过的样子！	伊/头拄仔/一直/咧/喘大气/，/若/像/足/艰苦的/！
死都死了，不要再来纠缠。	死/都/死啰/！/毋通/阁/来/交缠/。
我对车子很在行。	我/对/汽车/真/内行/。
听你的腔调好像是台南人。	听/你/的/腔口/敢若/是/台南/人/。
晚上有什么配菜？	暗顿/有/啥物/物配/？
大家对他的印象很好。	逐家/对/伊/的/印象/真/好/。
你不要随便拿竹枝打小孩。	你/莫/攑/箠仔/乌白/拍/囡仔/。
你居然敢不听我的话。	你/竟然/敢/毋/听/我/的/话/。
请大家自己来，不要拘束。	请/逐家/随意/，/毋通/拘/礼/。
煮菜加味精会比较有味道。	煮/菜/掺/味素粉/较/有/气味/。
你如果想告他，要拿出证据。	你/若/欲/告伊/，/爱/提出/证据/。
他自愿来的。	伊/志愿/来的/。
这四周都是泥沙。	遮/四箍围仔/拢/是/涂沙/。
现在穿对襟衣的人越来越少了。	这马/穿/对襟仔衫/的/人/愈/来/愈/少矣/。
我姪子下个月要成亲，我嫂嫂很高兴。	阮/孙仔/后/个/月/欲/娶/，/阮/阿嫂/足/欢喜的/。
老板人真好，我一两天没去，他也不会怎样。	头家/人/真/好/，/我/一半日仔/无/去/，/伊/嘛/袂/按怎/。
讲了一大堆没用的话。	五四三/，/讲/甲/规/米篮/。
他以前在银楼上班。	伊/旧底/伫/金仔店/食头路/。
算算看多少钱。	算/看/偌济/钱/。
绕到山脚下来。	弯/对/山跤/落来/。
他最喜欢拿望远镜看稀奇的鸟类。	伊/上/爱/提/千里镜/看/希罕/的/鸟仔/。
这下子事情难处理了。	这声/代志/歹/纺矣/。
你是在说什么？我怎么都听不懂？	你/是/咧/讲/啥物/碗糕/？/我/哪/会/听/拢/无/？
这个小孩不挑食。	这/个/囡仔/真/好喙斗/。
他数学的基础稳固。	伊/数学/的/底蒂/真好/。
交考卷之前要检查检查。	交/考试单仔/进前/爱/巡巡咧/。
你如果要出去，门顺手关上。	你/若/欲/出去/，/门/绁手/关起来/。
那里有一辆车车。	遐/有/一/台/哹哹/。
咱们这儿有八个人，那些东西才五人份，还不够三人份。	咱/遮/有/八/个/人/，/遐的/物件/才/五/人额/，/犹/无够/三/个/人额/。
听说头凸的孩子比较聪明。	听讲/扩头/的/囡仔/较/巧/。
 哭丧着脸，人缘不佳。	孝男面/，/无人缘/。
他是节俭的人，舍不得花钱享受。	伊/是/虬俭/的/人/，/毋甘/开钱/享受/。
他把钱握得紧紧的。	伊/共/钱/扲牢牢/。
他对篮球运动很有兴趣。	伊/对/篮球/运动/真/有/兴趣/。
说到种花他还有点能耐！	讲着/种花/伊/阁/有二步七仔/！
他用手肘碰我一下，暗示我他要先离开一下。	伊/用/手后曲/共/我/㧎/撞一下/，/暗示/我/伊/欲/先/离开一下/。
今天的会议由他来主持。	今仔日/的/会议/由/伊/来/主持/。
蛋、牛奶、肉类、豆类是吾人的食物当中重要的蛋白质来源	卵/、/牛奶/、/肉类/、/豆仔类/是/咱/人/的/食食/当中/重要/的/卵白质/来源/。
他说当选之后，要整顿市场，结果都是虚假。	伊/讲/当选/了后/，/欲/整顿/市场/，/结果/拢/无/影迹/。
他这人是个直肠子，想到什么说什么，请你不要见怪。	伊/这/个/人/直肠直肚/，/想着/啥/讲/啥/，/请/你/毋通/见怪/。
棉被先卷起来再收进袋子里。	棉被/先/卷起来/才/收/入去/袋仔/内/。
那间新开的海产店，啤酒类无限量供应你喝。	彼/间/新/开/的/海产店/，/麦仔酒/予/你/啉/迵海的/。
以前性交易经营者，叫做乌龟。	古早/开/查某间/的/人/叫/做/乌龟/。
难道说你对我一点感情都没有？	敢讲/你/对/我/一点仔/感情/都/无/？
他常常用美女做钓饵，来骗别人的钱。	伊/定定/用/媠/查某/囡仔/做/钓饵/，/来/骗/人/的/钱/。
这个小孩很有活力。	这/个/囡仔/真/𠢕/走跳/。
地板很滑，走路要小心。	涂跤/真/滑/，/行路/爱/细腻/。
你是不是在外面欠别人钱？	你/是/毋/是/伫/外口/有/欠/人/钱/？
无论职业是什么，都要认真努力。	无论/职业/是/啥/，/拢/爱/认真/拍拚/。
竹管被火烧得爆开。	竹管/予/火/烧/甲/煏开/。
妈妈很会跟人家讨价还价。	阿母/诚/𠢕/佮/人/讲价/。
我快被这些书压扁了！	我/强欲/予/遮的/册/硩扁矣/！
若没有人要去，我们就抽签来决定。	若是/拢/无人/欲/去/，/咱/就/抽阄/来/决定/。
我女儿今年要考大学。	阮/查某囝/今年/欲/考/大学/。
 他那个人藏不住话，你别什么事都讲给他听。	伊/的/人/袂/囥话/，/你/莫/啥物/代志/拢/讲/予/伊/听/。
请你让我过一下。	请/你/让/予/我/过一下/。
才喝这点儿酒而已，还没开始过瘾啦！	才/啉/这点仔/酒/尔/，/犹未/起磅咧啦/！
你不要吓我。	你/莫/吓惊我/。
世间上有很多事情是无法预料的。	世间上/有/真/济/代志/是/袂/按算的/。
学生们每天都要去学校读书。	学生/囡仔/逐/工/拢/爱/去/学校/上课/。
以前都是用米筛子来筛选米。	较早/拢/用/米筛/来/筛/米/。
他是我们学校地理老师。	伊/是/阮/学校/的/地理/老师/。
送奠仪给丧家，是为了帮忙丧家。	包/纸敬/予/丧家/，/是/为着/欲/共/丧家/斗相楗/。
我去为你说媒。	我/来去/共/你/讲亲情/。
每个人在那里排队，是为了要买演唱会的门票。	逐/个/伫/遐/排列/，/是/为着/欲/买/演唱会/的/门票/。
穿裙子要穿丝袜。	穿/裙/爱/穿/丝仔袜/。
好像失去了光亮一般。	宛然/失/光明/。
大家要同心协力，才会成功。	逐家/爱/和齐/，/才/会/成功/。
说到车子，他可是行家。	若/讲着/车/，/伊/是/内行的/。
你要出去做生意，不想再待家里，得要顾及种田的父亲，先跟他商量。	你/欲/出去/做/生理/，/无爱/阁/蹛/厝内/，/着爱/尊存/作穑/的/老爸/，/先/佮/伊/参详/。
自己管教得好，就不怕别人来查究。	家己/管教/好/，/毋惊/别人/来/稽考/。
树上的小鸟在啼叫。	树仔顶/的/鸟仔/咧/吼/。
病医后有比较好。	病/医/了/有/较/好/。
要不是我救了他，他早就没命了。	若/毋是/我/救伊/，/伊/早/就/无命矣/。
你如果不乖一点，我就把你捉来打屁股。	你/若/无/较/乖咧/，/我/就/共/你/掠来/拍尻川/。
你一张脸像死人脸，一点血色也没有。	你/一/个/面/敢若/死人面/，/一点仔/血色/都/无/。
东西让人偷拿走了！	物件/予人/勍去矣/！
混迹黑道没有了局。	𨑨迌/无了时/。
宝贵的东西要存放好。	贵重/的/物件/爱/囥/予/伊/好/。
从天井看出去，刚好可以看到月亮。	对/天井/看出去/，/拄好/会当/看/着/月娘/。
我向他借书。	我/共/伊/借/册/。
虽然我和你爸爸同年龄，但是论辈份不论年纪，咱们算同辈，叫我哥哥就好。	虽然/我/佮/恁/阿爸/平岁/，/毋过/论/辈/无/论/岁/，/咱/算/仝沿的/，/叫/我/阿兄/就/好/。
衣服塞得很密实。	衫仔/櫼/甲/密密密/。
公园里面的花草比较稀疏。	公园/内面/的/花草/较/疏栊/。
我要去买一本小笔记本回来记帐。	我/欲/去/买/一/本/手折簿仔/转/来/记数/。
难道他被人家施符咒了？	敢讲/伊/去/予/人/放符仔/？
你要是不努力一点，马上就比不上人家。	你/若/毋/较/拍拚咧/，/连鞭/就/无法度/佮/人/比并/。
这件事情我会向校长报告。	这/件/代志/我/会/去/向/校长/报告/。
我们家的果园种柑橘与芭乐。	阮/兜/的/果子园/种/椪柑/佮/菝仔/。
你今天是怎样，怎么无精打采的？	你/今仔日/是/按怎/，/哪/会/无揽无拈/？
这件事情我愿意做。	这/件/代志/我/愿意/做/。
金水婶的三个儿子都很有才华，不是经理就是董事长。	金水/婶仔/三/个/后生/拢/诚/有/才情/，/毋是/经理/，/就是/董事/长/。
台风天最怕停电，我们得要准备蜡烛。	风台/天/上/惊/失电/，/咱/着爱/准备/蜡烛/。
趁热快吃，冷掉就不好吃了。	趁/烧/紧/食/，/冷去/就/无/好食矣/。
从这里剪下去。	对/遮/裁落去/。
这项工作真是困难。	这/项/工课/真/硬笃/。
做人要实在一点，不要太浮夸。	做人/爱/较/朴实咧/，/毋通/伤/虚华/。
以前槺榔是制作扫把的主要材料。	早前/槺榔/是/做/扫帚/的/主要/材料/。
他喀了老半天都喀不出痰。	伊/喀/规半晡/拢/喀/无/痰/。
他说话含糊不清，我都听不懂。	伊/讲话/喑恶/，/我/拢/听/无/。
他那个人注重饮食不注重穿着。	伊/彼/个/人/重食/无/重穿/。
橘子干瘪掉了。	柑仔/脯去矣/。
你有足够的钱再买。	你/钱/若/有够/才/通/买/。
这把刀的刀口很锋利。	这/支/刀/的/刀喙/真/利/。
衣服乱丢在床上，好像在腌咸菜一样。	眠床顶/衫/乱/㧒/，/袂输/咧/沤咸菜咧/。
团体生活，各人的用品得做记号，才不会拿错了。	团体/生活/，/各人/的/用品/着/做/记认/，/才/袂/提/毋着去/。
她的皮肤很细嫩。	伊/的/皮肤/幼面面/。
二个人抱在一起。	两/个/人/𢯾/做伙/。
用发夹把头发夹好。	用/头毛铗仔/共/头毛/铗/予/伊/好/。
生活真艰困。	日子/真/歹/过/。
我的衣服被人家戳破一个大洞。	我/的/衫/予/人/黜/一/空/真/大/空/。
我是穷人出身。	我/是/艰苦人/出身/。
他说的话很荒唐，会有人相信吗？	伊/讲/的/话/譀呱呱/，/敢/有/人/会/相信/？
你要是有空的话，应该抽个空去看他一下。	你/若/有闲/，/就/爱/阆工/去/共/伊/看一下/。
没有你在我身边，我倍感孤单。	无/你/伫/我/的/身边/，/我/加/诚/孤单/。
我会很难过。	我/会/真/毋甘/。
天空一点云都没有。	天顶/拢/无/云/。
我偷偷跟你说，你不要跟别人说。	我/共/你/偷/讲/，/你/毋通/共/别人/讲/。
每天上班老是屈着身子待着，趁假日出去爬山，抒解一下。	逐工/上班/屈牢牢/，/趁/歇困日/出去/𬦰山/，/消敨一下/。
大家都不知道他跑到哪里去了。	逐家/拢/毋/知影/伊/走/去/佗位/。
我们这几位都是校友。	阮/这/几/个/拢/是/校友/。
他活到八十好几了，依然很硬朗，爬上爬下很敏捷。	伊/食/甲/八十/外仔外矣/，/犹阁/诚/硬插/，/𬦰悬𬦰低/真/扭掠/。
他是一般人。	伊/是/一/个/普通/人/。
你的手要扶好，才不会跌倒。	你/的/手/爱/扞/予/伊/好/，/才/袂/跋倒/。
我们的货还没堆上船。	咱/的/货/犹未/落水/。
你稍等一下，马上就好了。	你/小等一下/，/连鞭/就/好矣/。
照说我这样做应该没错，怎么会失败呢？	照讲/我/按呢/做/应该/无/毋着/，/哪/会/失败咧/？
你儿子今年考上哪一所大学？	恁/后生/今年/考着/佗/一/间/大学/？
你今天要出去玩对吧？	你/今仔日/欲/出去/𨑨迌乎/？
你们这边有什么好吃的可以充饥？	恁/遮/有/啥物/好食的/通/治枵/？
衣服裂开来了，要赶快缝一缝。	衫/裂去/，/爱/紧/紩紩咧/。
你们如果要去爬山，最好有人可以带路。	恁/若/欲/去/𬦰山/，/上好/有/人/𤆬路/。
他是好心要帮助人，却被嘲笑是大傻瓜。	伊/是/好心/欲/帮助人/，/煞/予/人/笑/讲/是/戆大呆/。
爸爸睡醒了。	阿爸/困醒矣/。
你想知道我跟他是怎么认识的？这就说来话长了。	你/想欲/知影/我/佮/伊/是/按怎/熟似/？/这/讲起来/就/话头/长/。
他说话很有趣。	伊/讲话/盖/心适/。
我家与他家间隔没几间房子。	阮/兜/佮/𪜶/兜/隔/无/几/间/厝/。
这个孩子做事情很规矩。	这/个/囡仔/做/代志/诚/规矩/。
花株正在开花，不要修剪。	花欉/当咧/开花/，/毋通/修剪/。
做生意一直贴钱，干脆结束吧。	做生理/一直/塌钱/，/规气/收收起来/。
脚碰伤了，走起来会痛。	跤/靠伤/，/行/着/会/疼/。
我看到两台车相撞。	我/看着/两/台/车/相碰/。
人情留一线，改天才不会恶脸相向。	人情/留/一/线/，/日后/才/袂/歹面相看/。
真是稀客，你今天怎么会有空来？	真/罕行/，/你/今仔日/哪/有闲/通/来/？
你实在很贪吃。	你/实在/有够/馋食/。
这个十字路口不准车辆回转。	这/个/十字路口/车/袂使/踅头/。
是谁在那叫喊？	是/啥人/伫/遐/咧/噭噭叫/？
你真是不知轻重，这种话竟然都说得出口。	你/诚/毋/知/轻重/，/这/款/话/你/曷/讲/会/出喙/。
你把这些水果拿去秤重。	你/共/遮的/果子/提去/磅重/。
你这样子做会被揭穿的。	你/按呢/做/会/去/予人/掠包/。
你一定要自我反省。	你/着爱/自我/反省/。
你尽管放心，到时候一定有贵人会出现。	你/做/你/放心/，/时/到/一定/有/贵人/会/出现/。
看到那个笑面虎我就恶心。	看着/彼/个/笑面虎/我/就/倒弹/。
那个女孩漂亮得不得了。	彼/个/查某/囡仔/袂讲得/媠/。
你什么时候要回来？	你/啥物/时阵/欲/转来/？
他们两个自从吵架以后，就不互相往来了。	𪜶/两/个/自从/冤家/了后/，/就/无/相交插矣/。
阿仁长得很高挑。	阿仁/生做/诚/挑俍/。
把毛巾沾湿。	面巾/揾/予/澹/。
用九层塔煎蛋很好吃。	用/九层塔/煎/卵/真/好/食/。
他看到蛇会害怕。	伊/看着/蛇/会/掣/。
夫妻一定要同心。	夫妇/着爱/仝/心/。
他一辈子吃苦，不曾享受过。	伊/规世人/食苦/，/毋/捌/享受过/。
他长得矮矮的，不会很高。	伊/生做/矮矮/，/袂/讲/盖/悬/。
他天生就是心地较软。	伊/的/本性/就/是/较/软心/。
现在是什么时间了？	这马/是/啥物/时候矣/？
你去顶楼收衣服。	你/去/楼尾顶/收/衫/。
不然你是在说笑是吗？	无/，/你/是/伫咧/讲笑诙/是毋/？
你的户籍所在地在哪里？	你/户口/伫/佗位/？
他很会摆架子，样子好像王爷。	伊/真/𠢕/激气/，/一/身/敢若/王爷公咧/。
他看起来很凶，不过对待他人却很好。	伊/看起来/真/柴耙/，/毋过/对/人/真好/。
东部营业处下个月月初起动，大家加油！	东部/营业处/后/个/月/月初/起磅/，/逐家/加油/！
我被你吓得差点腿软！	我/予你/惊/一下/险/软跤/！
他本来就这样闷不吭声，不喜欢和别人打招呼。	伊/本成/就/按呢/噷噷/，/无/爱/佮/人/相借问/。
他是知道还不知道？	伊/是/知/抑/毋知/？
哎！真可惜。	哎/！/真/拍损/。
他们家是有钱人，每餐都吃山珍海味。	𪜶/兜/是/好额人/，/逐/顿/食的/拢/是/山珍海味/。
突然要叫我做编辑的工作，我做不上来。	步频/欲/叫/我/做/编辑/的/工课/，/我/做/无路来/。
他们家族的男孩子照辈份取名，女孩子没有。	𪜶/家族/的/查埔囡仔/有/照/字匀/号名/，/查某囡仔/无/。
开车要走那条弯曲的路，你要小心！	驶车/欲/行/彼/条/弯曲/的/路/，/你/着/细腻/！
一大堆繁杂的事情，怎么做都做不完。	代志/沓沓滴滴/，/按怎/做/都/做/袂/了/。
白米归白米，糙米归糙米，要分开放，不要混在一起。	白米/还/白米/，/糙米/还/糙米/，/爱/分开/囥/，/毋通/相/滥/。
我很高兴接受你的好意。	你/的/好意/我/真/欢喜/共/你/领受/。
年纪那么大了，脾气还这么坏。	岁头/遐/济矣/，/阁/遮尔/歹性地/。
戏马上就要开演了。	戏/连鞭/就/欲/起鼓矣/。
他大小事都置身事外，不愿帮忙。	伊/大细/项/代志/拢/激外外/，/毋肯/共/人/斗相共/。
工作进行得很顺利。	工作/进行/了/真/顺利/。
遇到事情要冷静，不要这么慌张。	拄/着/代志/爱/冷静/，/毋通/遐/生狂/。
爷爷一大早就去田里施肥了。	阿公/透早/就/去/壅/田矣/。
今年香蕉产量稳定，价钱好，蕉农每个都眉开眼笑。	今年/弓蕉/产量/稳定/、/价数/好/，/蕉农/逐个/拢/喙笑目笑/。
想不到你会这样对待我。	想/袂/到/你/会/按呢/对待我/。
去他家的路途真远。	去/𪜶/兜/的/路途/真/远/。
做红龟粿时要用红花粉染色。	做/红龟粿/的/时/爱/用/红花粉/做色/。
农曆十二月，芥菜盛产。	旧曆/十二月/，/芥菜/大出/。
三天太赶了，交不出来。	三/工/伤/赶矣/，/交/袂/出来/。
要下大雨了，我们赶紧离开沙地。	欲/落大雨矣/，/咱/爱/紧/离开/沙埔/。
形容太过疲倦。	困/甲/袂/翻身/。
他去干活了。	伊/去/做工矣/。
他真有情，搬离开那么久了，还会常常来拜访。	伊/真/有情/，/搬去/遐/久矣/，/阁/会/定定/来/相揣/。
形形色色的人	十花五色/的/人
这些东西我一起跟你买，你要算我便宜些。	遮/的/物件/我/拢总/共/你/买/，/你/爱/算/我/较/俗/。
我丈夫的大哥比我丈夫大三岁	阮/大伯仔/大/阮/翁/三/岁/。
这些合计起来是多少？	遮/合算起来/是/偌济/？
他吓到全身发抖。	伊/惊/甲/规身躯/起/交懔恂/。
拿盐来把鸡抹一抹。	提/盐/来/共/鸡仔/捋捋咧/。
他的小孩真可爱。	伊/的/囡仔/真/古锥/。
你真笨呢，敢在他面前说谎。	你/歁歁呢/，/敢/伫/伊/的/面头前/讲白贼/。
他就像公司的外交部长。	伊/可/比/是/公司/的/外交部长/。
下回你再出差错，我就不要帮你忙了。	后摆/你/若/阁/脱箠/，/我/就/无/爱/共/你/斗相共矣/。
事情做到一半就逃跑了。	代志/做/甲/半路/就/阆港矣/。
他是一个老实人，你不要捉弄他了。	伊/是/一/个/古意人/，/你/莫/共/伊/创治啦/。
抽屉卡住了！	屉仔/卡牢咧/！
我曾听过白贼七的故事。	我/捌/听过/白贼七仔/的/故事/。
这间公司的产品都有这个商标。	这/间/公司/的/产品/拢/有/这/个/标头/。
他活着的时候做了很多好事，死后一定会上天堂。	伊/在生/的/时阵/做/真/济/好/代/，/死/了后/一定/会/上/天堂/。
有话慢慢说。	有/话/慢慢仔/讲/。
那个孩子长得比较丑。	彼/个/囡仔/生做/有/较/㾀/。
要跑走了，快追！	欲/走矣/，/紧/追/！
我的肚子痛得要死。	我/的/腹肚/疼/甲/欲死/。
尝起来苦中带甜。	食/着/苦甘仔/苦甘/。
他愁眉苦脸的，不知道在烦恼什么？	伊/一/个/面仔/忧结结/，/毋/知/咧/烦恼/啥/？
真巧，他们两个同时到。	真拄好/，/𪜶/两/个/𫝛时/到位/。
他又在装疯卖傻了。	伊/阁/咧/假痟矣/。
这件事让你添麻烦了，谢谢你！	这/件/代志/予/你/加/真/麻烦/，/劳力喔/！
他不去医院让医生看，宁可买草药乱吃。	伊/毋/去/病院/予/医生/看/，/甘愿/买/药草仔/乌白/食/。
这张椅子不太稳，不要坐。	这/只/椅仔/无/啥/稳/，/毋通/坐/。
我不曾欠别人帐。	我/毋捌/咧/共/人/欠数/。
请你不要推辞。	请/你/毋通/推辞/。
这种事情求神拜佛也没用。	这/款/代志/求神问佛/嘛/无效/。
买水果的钱，一人要出一半。	买/果子/的/钱/，/一/人/爱/出/一半/。
他的人际关系不错。	伊/的/外交/袂䆀/。
无法将小孩哄到安静！	囡仔/骗/袂/恬/！
这件衣服料子不好，穿起来有点紧。	这/领/衫/料/无/好/，/穿着/绷绷/。
赏你一百块钱。	赏/你/一百/箍/。
他自封为鸭母王。	伊/共/家己/封/做/鸭母/王/。
现在外面天色很昏暗，等一下一定会下大雨。	这马/外口/乌天暗地/，/等一下/一定/会/落/大/雨/。
袋子内翻一些零钱出来。	袋仔/内/反/一寡/银角仔/出来/。
他很喜欢收集邮票。	伊/诚/爱/收集/邮票/。
喉咙被鱼刺哽到。	咙喉/去/予/鱼刺/哽着/。
这个牛舍里有几只公牛？	这/个/牛牢/内底/有/几/只/牛犅/？
一大早就听到这么不吉利的话，实在很倒楣。	透早/就/听着/遮尔/歹吉兆/的/话/，/实在/有够/衰/。
你不要笑他老土，他很有学问又有修养。	你/毋通/笑/伊/倯/，/伊/真/有/学问/阁/有/修养/。
气象报告说明天会比今天寒冷。	气象/报告/讲/明仔载/会/比/今仔日/较/寒/。
我明明有听到他的声音，怎么会找不到人？	我/明明/有/听着/伊/的/声/，/哪/会/揣无/人/？
希望你可以成全我。	希望/你/会使/成全我/。
你怎么这么笨？连这个也不会。	你/哪/会/遮尔/跤梢/？/连/这/曷/袂晓/。
间隔一小时再吃药。	隔/一/点钟/才/食/药仔/。
他会认床，每次出国旅行都睡不着。	伊/会/忌床/，/逐/摆/出国/旅行/拢/困/袂/去/。
他的酒还没醒，你别去吵他。	伊/犹未/退酒/，/你/莫/去/共/伊/吵/。
你一个月赚多少钱？	你/一/月日/趁/偌济/钱/？
立冬炖补，给父母补身子。	立冬/燖补/，/共/序大人/侹/身体/。
他和我最知心。	伊/佮/我/上/贴心/。
阿美他老公不拘小节，很好相处。	阿美/𪜶/翁/真/靠俗/，/真/好/斗阵/。
他话一说完，马上转头自顾自地呼呼大睡。	伊/话/讲煞/，/随/越头/做/伊/去/摔大眠/。
亲事没谈成，别想结婚。	亲事/讲/袂/成/，/免/想欲/结婚/。
星期日一起去爬山。	礼拜/才/做伙/来去/𬦰山/。
