他走他的，我走我的。	伊/做/伊/行/，/我/做/我/行/。
你如果再讲不听，本性不改，以后吃苦的是自己。	你/若/阁/讲/袂/听/，/原性/不/改/，/以后/食苦的/是/家己/。
这本书多少钱？	这/本/册/偌济/钱/？
现在的棒球比赛都很注重战术。	这马/的/野球/拢/真/注重/战术/。
这颗鸡蛋已经受精了。	这/粒/鸡卵/有雄/。
饮食要控制。	饮食/爱/节制/。
你不要猜疑我对你的一片情意。	你/毋通/𢙒疑/我/对/你/的/感情/。
他现在在家睡觉。	伊/这马/伫/厝里/咧/困/。
他有时候也会帮我。	伊/有时仔/嘛/会/共/我/斗跤手/。
这一带都是他的地盘，你不要去惹他。	这/箍围仔/拢/是/伊/的/地头/，/你/毋通/去/惹伊/。
阿荣是家里的老么，从小就备受疼爱。	阿荣/是/厝内/的/屘囝/，/自/细汉/就/真/得人疼/。
你对这件事情有什么感想？	你/对/这/件/代志/有/啥物/感想/？
这些东西老旧破烂，还舍不得丢弃。	遮的/物件/旧沤旧臭/，/阁/毋甘/掷㧒捔/。
我们依约行事，你别想搞花样乱来。	咱/照呼照行/，/你/莫/想欲/变鬼变怪/。
你要有出息别人才会看重你。	你/爱/有/出脱/人/才/会/看你有/。
你赶快阻止他。	你/紧/共/挡咧/。
让他去啦！别理他。	予/伊/去啦/！/莫/插伊/。
做人家的晚辈要敬重长辈。	做/人/的/序细/着爱/尊重/序大人/。
小孩看到斑马，就眉开眼笑。	囡仔/看着/花条马/，/就/喙笑目笑/。
他真残忍，经常打猫、打狗。	伊/真/残忍/，/不时/拍/猫/、/拍/狗/。
那个女孩子十分贪吃。	彼/个/查某/囡仔/足/贪食的/。
等一下麻烦你发言帮我说些好话好吗？	等一下/麻烦/你/出喙/共/我/斗/讲/寡/好话/好无/？
这个杯子有裂痕，不要再用了。	这/块/杯仔/有/必痕/，/毋通/阁/用矣/。
不论是谁问你，你都不可以说。	毋管/是/啥人/共/你/问/，/你/拢/袂使/讲/。
他和他爸爸长得很像。	伊/佮/𪜶/老爸/生做/诚/成/。
小男孩，你要去哪？	囡仔兄/，/你/欲/去/佗位/？
我要去逛街。	我/欲/来去/踅街/。
我们老板会用杀鸡儆猴的方法管理部下，让人感觉不太舒服。	阮/头家/会/用/刣鸡教猴/的/方式/管理/部下/，/予/人/感觉/无/啥/爽快/。
他还年轻，希望你能多多提拔他。	伊/犹阁/少年/，/向望/你/共/伊/牵成/。
请你替我向他问候。	请/你/替/我/共/伊/致意/。
昨天晚上下起大雨，阿英她家就淹了大水。	昨暗/落/大/雨/，/阿英/𪜶/兜/煞/做水灾/。
西晒的房子较热。	西照日/的/厝/较/烧热/。
那只狗在发情了。	彼/只/狗仔/咧/𪁎矣/。
你心里有什么冤屈，都讲出来没关系。	你/心内/有/啥物/冤屈/，/拢/讲出来/无要紧/。
小孩子骑车要留意谨慎，不要骑太快。	囡仔人/骑车/爱/小心/，/毋通/骑/伤/紧/。
你这个肮脏鬼，那个那么脏你还去摸。	你/这/个/癞𰣻鬼/，/彼/遐/垃圾/你/曷/去/摸/。
他连续三次都考第一名。	伊/连绁/三/摆/拢/考/第一/名/。
是什么事让他不高兴？	是/啥物/代志/予/伊/起毛/䆀/？
学习技艺，如果有人引导，比较快熟练。	学/工夫/，/若/有/人/引𤆬/，/较/紧/学/上手/。
他爷爷已经过世了。	𪜶/阿公/已经/过往矣/。
昨天没做完的，现在接着做。	昨昏/做/无/了的/，/这马/接/落去/做/。
过了端午节，冬衣就可以收起来了。	五月节/过了/，/寒衫/就/会当/收起来矣/。
这片墙破了两个洞。	这/堵/壁/缺/两/隙/。
你能这么想，实在是很难得。	你/会当/按呢/想/，/实在/真/难得/。
这间店必须是行家才会知道。	这/间/店/着爱/巷仔内的/才/会/知/。
你身怀六甲，出入走路行动要小心喔！	你/大身大命/，/出入/行踏/爱/细腻喔/！
长癣要去看皮肤科。	生/癣/爱/去/看/皮肤科/。
他的脸有疤痕。	伊/的/面/有/疤/。
感冒会传染。	感冒/会/过人/。
他家的财产都被他败光了。	𪜶/兜/的/家伙/拢/予/伊/败了了矣/。
看见杨梅，就会止渴。	看见/树梅/，/就/会/止/喙焦/。
我希望下辈子能成为女人。	我/希望/后出世/会当/做/查某/。
一只好好的手表玩弄到坏了。	一/粒/好好/的/表仔/变弄/甲/害害去/。
东西收在抽屉下面。	物件/收/伫/屉仔/下底/。
散会时，我们准备了三、四百块凤梨酥，在大门口送给客人。	散会/的/时/，/阮/有/攒/三/、/四百/块/王梨酥/，/伫/大/门口/送/予/人客/。
你只顾自己大步走，都不等我！	你/做/你/大/伐/行/，/拢/无/欲/等我/！
晚起的鸟儿没虫吃。	晏/起来/作/无/穑/。
树是实心的，不像竹子是空心的。	树仔/是/实腹的/，/无/亲像/竹仔/是/空壳的/。
年老了脸皱皱的。	食老/面/皱皱/。
他为人处世好像戴着面具，心口不一，不能信任。	伊/戴/小鬼仔壳/咧/做人/，/喙/无/迵/心肝/，/袂/信用得/。
腰束太紧会不舒服。	𦈝/腰/𦈝/伤/絚/会/艰苦/。
米是按重量卖的。	米/是/照/重声/卖的/。
希望你能好好做人。	向望/你/会当/好好仔/做人/。
这块田地是活卖的，等十年后晚辈能耕种的时候再买回来。	这/块/田/是/活卖的/，/等/十/年/后/序细/有法度/做/的/时/才/阁/买转来/。
这块肉很有韧性。	这/块/肉/真/韧/。
这支螺丝的螺纹已经磨损了！	这/支/螺丝/的/牙/萎去矣/！
做那种生意，不是赚大钱，就是赔大钱。	做/彼/款/生理/，/毋/是/趁/大钱/，/就/是/了/大注/。
这个小孩子嘴巴真甜，看到客人来，都会跟人打招呼。	这/个/囡仔/真/好喙/，/看/着/人客/来/，/拢/会/共/人/叫/。
因为他不断的换工作，所以经常在搬家。	因为/伊/不时/换/头路/，/所以/定定/咧/搬厝/。
这些也都是好的。	遮的/嘛/拢/是/好的/。
船停在桥下。	船仔/歇/伫/桥跤/。
我们在门口相遇。	阮/伫/门口/相拄/。
这个婴儿养得肥肥胖胖的，长得好可爱。	这/个/婴仔/饲/甲/诚/肨奶/，/生做/足/古锥/。
她们一早就去采茶了。	𪜶/透早/就/去/挽/茶矣/。
你不要再来烦扰我。	你/毋通/阁/来/膏膏缠/。
你做事不能太死板，有时候要变通一下。	你/做/代志/毋通/硬迸迸/，/有时阵/爱/变通一下/。
你以为装得漠不关心就没事了是吗？	你/想讲/激外外/就/无/代志矣/是无/？
关公拿关刀，过五关，斩六将。	关公/攑/关刀/，/过/五/关/，/斩/六/将/。
他被车子撞得不醒人事。	伊/予/车/挵/一下/毋知人/。
他们两个在那里争吵很久了，我被吵得快发疯了。	𪜶/两/个/伫/遐/相嚷/诚/久矣/，/我/予/𪜶/吵/甲/强欲/起痟矣/。
我曾祖父在早晨就断气了。	阮/阿祖/早起/就/过气矣/。
改天较闲时再去。	别日仔/较/闲/才/来去/。
让他赚了一笔。	去/予/伊/趁/一/手/去/。
人家说双胞胎往往能彼此感应。	人/讲/双生仔/定定/会/互相/感应/。
拜他做师父。	认/伊/做/师傅/。
我这样做是因为我看得起你。	我/按呢/做/是/看会起你/。
我们做事情要有分寸。	咱/人/做/代志/着爱/有/站节/。
你真是识货！	你/有影/捌货/！
人家要请你吃饭，你别臭美了！	人/欲/请你/，/你/都/无/咧/媠面阁/！
在乡下地方，左邻右舍的感情都很好。	伫/庄跤/所在/，/厝边头尾/的/感情/拢/诚/好/。
再后退一点。	阁较/倒退淡薄仔/。
我们公司成立要两年了。	阮/公司/成立/欲/两/冬矣/。
我先生差不多傍晚就会回来，你再等一下。	阮/翁/差不多/暗头仔/就/会/转来/，/你/阁/等一下/。
这次台风损失很多财产。	这/摆/风台/损失/足/济/财产/。
一个人做不了什么工作。	单跤手/做/较/无/工课/。
书被蠹虫蛀掉了。	册/予/剪虫/剪去矣/。
农民生活不好过，丰收时农产品贱价，欠收时又入不敷出。	作穑人/生活/无/好/过/，/丰收/的/时/农产品/歹价/，/歹年冬/阁/收/无/通/食/。
最近毛猪的市价有高一些。	最近/猪铺/有/较/夯/。
我的车票买的是来回的。	我/的/车票/是/拍/往回的/。
时间还很充足。	时间/阁/真/冗/。
这一切都是你自作自受。	这/一切/拢/是/你/自作自受/。
我听得很清楚。	我/听/甲/足/现/。
他心肠很软，你拜托他，他会帮你忙。	伊/真/软心/，/你/共/拜托/伊/会/共/你/斗相共/。
他的病怎么好得那么快？难道是吃到仙丹？	伊/的/病/哪/会/好/甲/遐尔仔/紧/？/敢/是/去/食着/仙丹/？
他就是太骄傲自大，才会失败。	伊/就/是/伤/靠势/，/才/会/失败/。
那个苦旦演得真好。	彼/个/苦旦/演/甲/诚/好/。
他是一个半吊子，你会放心将工作交给他做吗？	伊/是/一/个/半路师/，/你/敢/放心/共/工课/交/予/伊/做/？
番石榴新鲜刚采收的，又脆又甜。	菝仔/在欉的/，/诚/脆/当/甜/。
我手掌的握力不够，提不起来。	我/手尾力/无够/，/捾/袂/起来/。
一开始他说好要来，到后来又不来。	寝头/伊/讲好/欲/来/，/到/落尾/又阁/毋/来/。
你不为自己想，也要为孩子的将来着想！	你/无/为/家己/想/，/嘛/着/为/囡仔/的/未来/设想/！
没有播种哪能指望收成。	无/掖种/欲/哪/会当/向望/收成/。
他又在装模作样了，别被他骗了！	伊/阁/咧/搬戏矣/，/你/毋通/予/伊/骗去/！
整天无理取闹，我都快被你烦死了！	规/工/枵饱吵/，/强欲/予/你/烦死/！
那只老鼠在吱吱叫。	彼只/鸟鼠/吱吱叫/。
你最近气色很差，大概是身体哪里有异样，你没察觉到吗？	你/最近/面色/诚/䆀/，/敢是/身体/佗位/有/各样/，/你/无/智觉着/是毋/？
你不必跟他说那么多，他早就被收买了。	你/免/佮/伊/讲/遐/济/，/伊/早/就/予/人/买收去矣/。
他们的英语老师是外国人。	𪜶/英语/老师/是/啄鼻仔/。
番石榴熟了没，用指甲刺探看看就知道。	菝仔/有/够分无/，/共/伊/㨂甲一下/就/知/。
他只要出门就穿着一身西装。	伊/见/若/出门/拢/雕/一/躯/西装/。
青葱要稍微浸一下水才会比较鲜脆。	葱仔/着爱/驻水/才/会/较/鲜脆/。
好好的一件事被你搞砸了。	好好/的/代志/予/你/舞/甲/开花去/。
除去田中杂草是很辛苦的工作。	挲草/是/真/艰苦/的/工课/。
真快！晃一下就三年过去了！	真/紧/！/三/年/晃一下/就/过矣/！
剩下的这些存货要怎么处理？	䞐/遮的/货底/欲/按怎/处理/？
她愈看愈美。	伊/愈/看/愈/媠/。
他为人很吝啬。	伊/做人/咸笃笃/。
你不要在那里瞎想了，快去做事情比较重要。	你/莫/伫/遐/戆想矣/，/紧/去/做/代志/较/要紧/。
不好的陶器会渗水。	䆀/的/粗瓷/会/过水/。
你这个短命鬼，把我的钱拿去赌博输光光。	你/这/个/夭寿短命的/，/共/我/的/钱/提/去/跋筊/输了了/。
母亲上个月给我的钱有多一点。	阿母/顶/个/月/予我/的/钱/有/长寡/。
哼！我才不要跟你去呢！	哼/！/我/才/无爱/佮/你/去咧/！
这件事情一说起来就生气。	这/件/代志/讲起来/就/心火着/。
我忘了写作业，所以才会被老师骂。	我/袂记得/写/功课/，/毋才/会/予/老师/骂/。
说到钱就退缩了。	讲着/钱/就/摄落去矣/。
他实在眼拙，看过就马上忘了。	伊/实在/足/钝目/，/看过/就/随/袂记得/。
青春期的孩子比较容易长烂痘，脸得洗干净。	青春期/的/囡仔/较/会/生/烂𤶃仔/，/面/爱/洗/予/清气/。
那个人的心地很坏。	彼/个/人/的/心肠/真/䆀/。
他出国之前有向大家辞别。	伊/出国/以前/有/向/逐家/辞别/。
他的火气上升了，你要小心一点。	伊/风火/夯起来矣/，/你/爱/较/细腻咧/。
这几天天气都不好。	这/几/工/拢/是/歹天/。
他自从做生意到现在就一直赔本。	伊/自/做生理/到今/一直/咧/塌本/。
我和他的房间只隔了一片木板墙。	我/佮/伊/的/房间/干焦/隔/一/块/枋堵/。
肩膀下垂的人穿衣服比较不好看。	垂肩/的/人/穿/衫/较/无/好看/。
他们打算大后年要出国留学。	𪜶/按算/落后年/欲/出国/留学/。
这一摊的炒花生，每一颗都非常饱满。	这/担/的/炒/涂豆/，/逐/粒/都/仁仁仁/。
今天吃得真饱。	今仔日/推/了/有够/饱的/。
她煮的东西很难吃。	伊/煮/的/物件/真/歹食/。
你女儿许配给人家了吗？	恁/查某囝/敢/做人矣/？
我的户头里还有少许存款。	我/的/口座/犹/有/淡薄仔/存款/。
两人互相揭短，结果都一样是出丑。	两/个/人/相挖空/，/平平/失气/。
菜市场内，人密密麻麻的。	菜市仔内/，/人/密密是/。
别吵新娘了，快让他们洞房。	莫/阁/吵/新娘矣/，/通/予/𪜶/洞房/。
开门要控制一下力道，不要太大声。	开/门/爱/小/节力一下/，/毋通/伤/大/声/。
他把饼干装进去盒子里头。	伊/共/饼/装/入去/盒仔底/。
糖再多一点。	糖/较/济一点仔/。
孩子的胃口不开。	囡仔/袂/开脾/。
你实在很会制造麻烦！	你/实在/真/𠢕/制造/麻烦/！
葱和蒜要如何区分？	葱仔/佮/蒜仔/欲/按怎/区别/？
他走路不小心竟去扭到。	伊/行路/无/注意/煞/去/𨂿着/。
你是带头的，不能推卸责任。	你/是/𤆬头的/，/袂使/卸/责任/。
东西选好了就去找店员结帐。	物件/拣/好/去/揣/店员/结数/。
为了帮助那个小孩，他四处去募款。	为着/欲/帮助/彼个/囡仔/，/伊/四界/去/题缘/。
我被他害得惨兮兮。	我/予/伊/害/甲/凄惨落魄/。
这种绳子比较结实耐用。	这/款/索仔/较/粗勇/。
我听你在撒谎，钱明明就是你拿的，还辩说没有。	我/听/你/咧/落下颏/，/钱/明明/就/是/你/提的/，/阁/诤/无/。
他真有礼貌。	伊/真/有礼貌/。
她体态丰满。	伊/生做/真/肉感/。
冰啤酒喝下肚真是凉透顶。	冰的/麦仔酒/啉/着/透心凉/。
如同你说的，这味药真有效。	像/你/讲的/，/这/味/药仔/真/有/效/。
半夜自己一个人走路回家，心里有点怕怕的。	半暝仔/一/个/人/行路/转去/，/心肝内/小可/胆胆/。
他有一间空屋要出租。	伊/有/一/间/空壳厝/欲/税人/。
他先生过世之后，他就守寡至今。	𪜶/翁/过身/了后/，/伊/就/守寡/到今/。
这个方向逆风很难走。	这/向/搢风/真/歹/行/。
我父亲脾气很好。	阮/查埔/老的/性地/诚/好/。
他的脸看起来就傻乎乎的样子。	伊/的/面/看/着/孝呆孝呆/。
你的书掉在地上了，还不捡起来？	你/的/册/拍交落去矣/，/犹/毋/抾起来/？
你做事情要安分点，别贪小便宜，因小失大。	你/做/代志/着/较/安份咧/，/毋通/痟/贪/軁/鸡笼/。
我在忙，孩子你帮我看一下。	我/咧/无闲/，/囡仔/你/共/我/影一下/。
我的房间有三坪大。	我/的/房间/有/三/坪/。
事情怎么会变成这种情况？	代志/哪/会/行/到/这/款/地步/？
他每天花天酒地，没多久就把他父亲留给他的钱花用殆尽。	伊/逐/工/花天酒地/，/无偌久/就/共/𪜶/老爸/放/予/伊/的/钱/溶了了矣/。
烧开水洗澡。	燃/烧水/洗身躯/。
他们家很富裕的说。	𪜶/兜/足/好额的讲/。
你有什么好的计谋？	你/有/啥物/好/的/计谋/？
大家都在忙，你竟坐在此偷闲。	逐家/拢/咧/无闲/，/你/坐/伫/遮/凉/。
这次的台风很大，你要提早预防。	这过/的/风台/诚/大/，/你/爱/提早/预防/。
浊水用明矾净化。	浊/水/用/矾/坐清/。
机器有某个地方故障，才不会运转。	机器/有/佗位仔/走縒/，/才/袂/振动/。
这么浓的酒很难入喉。	遮/厚/的/酒/真/歹/落喉/。
他连夜去看病。	伊/透暝/去/揣医生/。
缺德！我们这条巷子昨天又遭小偷了。	夭寿/！/阮/这/条/巷仔/昨昏/又阁/着贼偷矣/。
你别看他瘦巴巴的样子，其实他很有耐力。	你/莫/看/伊/瘦/阁/薄板/，/其实/伊/诚/有挡头/。
大家连续走向他身边，要给他签名。	逐家/相连绁/行/对/伊/身躯边/，/欲/予/伊/签名/。
整天忙得像陀螺。	规日/无闲/甲/若/干乐咧/。
他很爱在背后说人的坏话。	伊/真/爱/伫/背后/讲/人/的/长短跤话/。
你压得住他吗？	你/敢/压/伊/会/牢/？
他站在后面。	伊/徛/伫/后尾/。
讲没两句话他就把对方揍了。	讲/无/两/句/话/伊/就/共/对方/㧌落去矣/。
天气很冷，你要记得戴手套。	天气/真/寒/，/你/爱/会记得/挂/手橐仔/。
这次的车票是买单程的。	这/遍/的/车票/是/拆/单逝的/。
我回来要做午饭，走进厨房就看到大女儿正在煮了。	我/转来/欲/攒/下昼顿/，/行/入/灶跤/就/看着/大汉/查某囝/当咧/煮矣/。
他在外地读书，花费一定比较高。	伊/伫/外位/读册/，/所费/一定/较/伤重/。
他一看见我来就赶紧躲开。	伊/看/着/我/来/就/紧/闪开/。
柿饼的柿霜不要洗掉。	柿粿/的/柿霜/毋好/洗掉/。
你如果安静不出声，不会有人把你当哑巴。	你/若/恬恬/莫/出声/，/无/人/会/讲/你/是/哑口/。
那个人鬼头鬼脑，成天都打歪脑筋要占人便宜。	彼/个/人/鬼头鬼脑/，/逐/工/都/想空想缝/欲/食人/。
拿刀的时候要拿刀柄，不要拿刀刃。	攑/刀/的/时/爱/攑/刀柄/，/毋通/去/捎/刀铓/。
你要找的那间房子在左手边。	你/欲/揣/彼间厝/伫/倒手爿/。
夹在抽屉缝里。	屧/伫/屉仔/内/。
你这样讲会得罪很多人。	你/按呢/讲/会/得罪/足/济/人/。
你做事要按部就班，不要常常想着要投机取巧。	你/做/代志/嘛/较/照起工咧/，/莫/定定/想欲/偷食步/。
人人都想要过自由的生活。	逐个/人/拢/嘛/想/欲/过/自由/的/生活/。
肮脏鬼三天不洗澡。	垃圾/人/身躯/三/工/无/洗荡/。
他一上台就忘了要念旁白。	伊/随/上台/就/袂记得/爱/念/口白/。
他喜欢找人家说话的漏洞，让人出丑。	伊/爱/揣/人/的/破空/，/共/人/落气/。
明明知道事情很严重，他也是要参与。	明明/知影/代志/真/严重/，/伊/嘛/是/蹽落去/。
再不走就走不掉啰。	阁/毋/走/就/走袂离啰/。
我老师不凶，对学生很客气。	阮/老师/袂/歹/，/对/学生/真/客气/。
他那么卑贱，比不上别人。	伊/遐尔/跤梢/，/佮/人/袂比得/。
这些我都要拿走。	遮的/我/拢/欲/提去/。
他只要搭车，就会晕车。	伊/便/若/坐/车/，/就/会/眩车/。
我来端碗帮你盛饭，你再稍等一会儿。	我/来/捀/碗/共/你/贮饭/，/你/阁/小等一下/。
新的公路要开隧道从这座山脚下穿过。	新/的/公路/欲/开/磅空/对/这/粒/山/下跤/迵过/。
他病痊愈了，早上看来神清气爽多了。	伊/病/好矣/，/早起/看/着/有/较/清彩/。
我们后面还有多少钱还没缴？	咱/后头/阁/有/偌济/钱/犹未/纳/？
反对的人是少数，你就安心去做。	反对/的/人/是/少数/，/你/就/放心/去/做/。
人生很难预料、掌握，不知从哪里来，也不知往哪里去。	人生/茫茫渺渺/，/毋/知影/对/佗位/来/，/嘛/毋/知影/对/佗位/去/。
现在很流行练功夫。	这马/练/工夫/真/时行/。
世间真的有鬼怪存在吗？	世间/敢/真正/有/鬼精/？
按预先讲好的来做，不可缩水。	照/品/照/行/，/袂使/勼水/。
我们要包礼庆贺他入新家。	咱/爱/包礼/共/伊/入厝/。
常常跟人打架的阿雄现在在学校的黑名单里了。	定定/佮/人/相拍/的/阿雄/这马/伫/学校/的/乌名单/内面矣/。
看你敢还是不敢？	看/你/敢/抑是/毋/敢/？
目前我们所遇到的问题都无法解决，要怎么办才好？	面前/咱/所/拄着/的/问题/拢/无法度/解决/，/是/欲/按怎/才/好/？
犯人听到要被人枪杀，吓得屁滚尿流。	犯人/听/着/讲/欲/予/人/铳杀/，/惊/甲/渗屎尿/。
用大石头压下去。	用/大/石头/硩落去/。
这个规定很没道理。	这/个/规定/诚/无理/。
憋尿是伤身的坏习惯，会引发肾脏病。	禁尿/是/伤/身体/的/歹/习惯/，/会/引起/腰子/病/。
你不可以跟他起争执。	你/毋通/佮/伊/冲突/。
你常常偷塞钱给他，别以为我不知道。	你/定定/偷/揜/钱/予伊/，/莫/当做/我/毋/知/。
把抽屉拉开。	共/屉仔/捝开/。
大人和小孩子争执，人家会笑。	大人/伨/囡仔/，/人/会/笑/。
伯父，这么久不见，您身体还是一样健朗呢！	阿伯仔/，/诚/久/无/看着矣/，/这马/犹阁/老康健呢/！
他的性命很危险。	伊/的/性命/真/危险/。
今天这出戏是演什么戏目？	今仔日/这/棚/戏/是/搬/啥物/戏文/？
爱吃糖又懒得刷牙，难怪牙齿蛀好几个洞。	爱/食/糖仔/阁/贫惰/洗喙/，/莫怪/喙齿/蛀/几若/空/。
活到七老八十了，还不认老。	食/甲/七老八老矣/，/犹阁/毋/认/老/。
这批货我全部包了。	这/批/货/我/拢/贸矣/。
推他出来选举。	㧣/伊/出来/选/。
电影里的妖魔鬼怪都长得脸色青绿、长牙外露。	电影/内面/的/妖魔鬼怪/拢/生做/青面獠牙/。
你说话那么大声，小孩子会受到惊吓啦！	你/讲话/讲/甲/遐/大声/，/会/共/囡仔/拍生惊啦/！
他决定要宰一头猪去还愿。	伊/决定/欲/刣/一/只/猪/去/谢愿/。
人活着，不要计较太多。	人生/在世/，/毋免/伤/计较/。
路口那间药房的生意很好。	路口/彼/间/药局/生理/真/好/。
坐月子的妇人不要去碰水。	月内/人/莫/去/沐/水/。
哈！被我捉到了。	哈/！/予/我/掠着矣/。
人家说吃猪血可以去除脏东西。	人/讲/食/猪血/会/去/垃儳/。
你说再多他也听不进去。	你/讲/阁较/济/伊/嘛/听/袂/入耳/。
这是手工做的面线。	这/是/手工/的/面线/。
挤进公车里面。	搢/入去/公车/内面/。
做事要有魄力。	做/代志/爱/有/气魄/。
你三个小时才可做好，他半个小时就做好了。	你/三/点钟/才/做/会/好/，/伊/半/点钟/就/做/好矣/。
你刚刚打电话来的时候，我正巧在洗澡。	你/头拄仔/敲/电话/来/的/时/，/我/拄咧/洗身躯/。
剩余的不多了。	后手/䞐/无/偌/济/。
水要溢出来了。	水/欲/满出来矣/。
他事业成功，生活过得很富裕。	伊/事业/成功/，/生活/过/甲/真/富裕/。
你不喜欢吃面，要不然我们去吃炒饭。	你/无/爱/食/面/，/无/咱/来去/食/炒饭/。
她嫌她老公不会说话。	伊/嫌/𪜶/翁/顸颟/讲话/。
他做什么生意都亏本，我看他最好不要做生意。	伊/做/啥物/生理/拢/蚀本/，/我/看/伊/毋通/做/生理/。
他们两夫妻现在想买房子。	𪜶/两/翁仔某/这马/想欲/蓄厝/。
这块地很肥沃。	这/块/田/真/肥/。
平均下来，每个人可以分到三千块钱。	平均落来/，/一/个/人/会当/分/着/三千/箍/。
那出戏演得很无趣。	彼/出/戏/搬/甲/真/无局/。
那间百年老店至今仍是第三代的老店东在领导主持店务。	彼/间/百年/老店/到/今/犹是/第三/代/的/老/头家/咧/徛台/扞店/。
想到这件事情，我就失眠睡不着。	想/着/这/件/代志/，/我/就/失眠/困/袂/去/。
地面凹下去。	涂跤/陷入去/。
鸟有翅膀才能飞。	鸟仔/有/翼/才/会/飞/。
父母养育子女很辛苦，我们长大后要孝顺父母。	爸母/育囝/真/辛苦/，/咱/大汉/了后/爱/有孝/爸母/。
这本书写得十分清楚明确。	这/本/册/写/甲/诚/明白/。
他得了第一名后，变得很臭屁。	伊/着/第一/名/了后/，/变/甲/足/臭屁/。
鱿鱼的触手就是鱿鱼的手跟脚。	鰇鱼须/就/是/鰇鱼/的/跤/佮/手/。
你对她的感情是认真还是玩玩而已？	你/对/伊/的/感情/是/认真的/抑是/𨑨迌/尔尔/？
那种坏人要给他教训。	彼号/歹物/爱/共/伊/教示/。
我才不要自讨苦吃。	我/才/无/欲/讨皮疼咧/。
你那个同事有没有，姓张的。	恁/彼/个/同事/无/，/姓/张的/。
正月初二女儿回老家归宁。	正月/初/二/查某囝/转/外家/做客/。
太阳从东边出来了。	日头/对/东爿/出来矣/。
我爷爷拿了耙子要去整理菜园。	阮/阿公/攑/爪仔/欲/去/整理/菜园/。
管他的！叫他自己想办法。	管待伊喔/！/叫/伊/家己/想/办法/。
就算你不满意，我们也没办法。	就/算/讲/你/无/中意/，/阮/嘛/无法度/。
你真的很烦。	你/真正/有够/烦/。
说来说去，总归一句，是你错了。	讲/来/讲/去/，/总讲一句/是/你/毋着/。
这班学生都是第一流的。	这/班/的/学生/拢/是/一等一的/。
吃饱饭后要把桌上收拾整理一下。	食饱/了后/爱/共/桌顶/收收咧/。
老板，西瓜一斤多少钱？	头家/，/西瓜/一/斤/是/偌济/钱/？
他们兄弟俩的感情很好。	𪜶/两/兄弟/的/感情/真/好/。
他被别人传染到流行感冒。	伊/予/人/感染着/流行/感冒/。
这下惨了，被你害得连我都遭殃了。	这声/惨矣/，/予/你/害/一下/连/我/嘛/着灾矣/。
旧账没清，别想再借钱。	旧数/无/还/，/免/想欲/阁/借钱/。
他胆识不错，有事情都是他出面解决。	伊/脚数/袂䆀/，/有/代志/拢/伊/咧/出头/。
